{"artifact_sha256":"ffd5f51aa08874e7e0188ad94435b50c30071c0dff67c8b9e9ec4c843290f41d","dataset_id":"dedup","dataset_version":"v0.1.0","reviewed_suppressions":[],"rule_set_sha256":"360d8d4ffa6ea775ab8fb6e9927fdac201df8bb3e9fd95e43bb594828d7be006","rule_set_version":"d0-technical-scan-rules-v3","scan_scope":"technical_patterns_only","scanned_at":"2026-07-24T00:00:00Z","tool":"careerops-d0-scan","tool_version":"2.1.0","unsuppressed_findings":[],"unsuppressed_findings_count":0,"version":2}
